{
  "$schema": "urn:watchtower:schema:artifacts:plan:validation-bundle:v1",
  "id": "evidence.first_party_root_pack_roots.bootstrap_validation_bundle",
  "initiative_id": "initiative.first_party_root_pack_roots",
  "trace_id": "trace.first_party_root_pack_roots",
  "title": "Bootstrap Validation Bundle",
  "status": "completed",
  "updated_at": "2026-03-22T16:30:08Z",
  "entries": [
    {
      "entry_id": "entry.first_party_root_pack_roots.schema_validation",
      "acceptance_label": "package_contracts_valid",
      "validation_type": "schema_validation",
      "owner": "repository_maintainer",
      "target_phase": "readiness",
      "expected_output_paths": [
        "plan/initiatives/first_party_root_pack_roots/.wt/initiative.json"
      ]
    },
    {
      "entry_id": "entry.first_party_root_pack_roots.gate_validation",
      "acceptance_label": "ready_for_execution_gate",
      "validation_type": "readiness_gate",
      "owner": "repository_maintainer",
      "target_phase": "readiness",
      "expected_output_paths": [
        "plan/initiatives/first_party_root_pack_roots/.wt/discrepancies"
      ]
    }
  ]
}
