{
  "$schema": "urn:watchtower:schema:artifacts:plan:validation-bundle:v1",
  "id": "evidence.plan_human_surface_policy_and_core_root_seeding.bootstrap_validation_bundle",
  "initiative_id": "initiative.plan_human_surface_policy_and_core_root_seeding",
  "trace_id": "trace.plan_human_surface_policy_and_core_root_seeding",
  "title": "Bootstrap Validation Bundle",
  "status": "planned",
  "updated_at": "2026-03-17T08:58:40Z",
  "entries": [
    {
      "entry_id": "entry.plan_human_surface_policy_and_core_root_seeding.schema_validation",
      "acceptance_label": "package_contracts_valid",
      "validation_type": "schema_validation",
      "owner": "repository_maintainer",
      "target_phase": "readiness",
      "expected_output_paths": [
        "plan/initiatives/plan_human_surface_policy_and_core_root_seeding/.wt/initiative.json"
      ]
    },
    {
      "entry_id": "entry.plan_human_surface_policy_and_core_root_seeding.gate_validation",
      "acceptance_label": "ready_for_execution_gate",
      "validation_type": "readiness_gate",
      "owner": "repository_maintainer",
      "target_phase": "readiness",
      "expected_output_paths": [
        "plan/initiatives/plan_human_surface_policy_and_core_root_seeding/.wt/discrepancies"
      ]
    }
  ]
}
