{
  "$schema": "urn:watchtower:schema:artifacts:plan:validation-bundle:v1",
  "id": "evidence.watchtower_work_item_lifecycle.bootstrap_validation_bundle",
  "initiative_id": "initiative.watchtower_work_item_lifecycle",
  "trace_id": "trace.watchtower_work_item_lifecycle",
  "title": "Bootstrap Validation Bundle",
  "status": "planned",
  "updated_at": "2026-03-17T07:43:33Z",
  "entries": [
    {
      "entry_id": "entry.watchtower_work_item_lifecycle.schema_validation",
      "acceptance_label": "package_contracts_valid",
      "validation_type": "schema_validation",
      "owner": "repository_maintainer",
      "target_phase": "readiness",
      "expected_output_paths": [
        "plan/projects/watchtower/initiatives/watchtower_work_item_lifecycle/.wt/initiative.json"
      ]
    },
    {
      "entry_id": "entry.watchtower_work_item_lifecycle.gate_validation",
      "acceptance_label": "ready_for_execution_gate",
      "validation_type": "readiness_gate",
      "owner": "repository_maintainer",
      "target_phase": "readiness",
      "expected_output_paths": [
        "plan/projects/watchtower/initiatives/watchtower_work_item_lifecycle/.wt/discrepancies"
      ]
    }
  ]
}
