{
  "$schema": "urn:watchtower:schema:artifacts:plan:validation-bundle:v1",
  "id": "evidence.pack_bootstrap_installation_contract.bootstrap_validation_bundle",
  "initiative_id": "initiative.pack_bootstrap_installation_contract",
  "trace_id": "trace.pack_bootstrap_installation_contract",
  "title": "Bootstrap Validation Bundle",
  "status": "completed",
  "updated_at": "2026-03-21T05:15:57Z",
  "entries": [
    {
      "entry_id": "entry.pack_bootstrap_installation_contract.schema_validation",
      "acceptance_label": "package_contracts_valid",
      "validation_type": "schema_validation",
      "owner": "repository_maintainer",
      "target_phase": "readiness",
      "expected_output_paths": [
        "plan/initiatives/pack_bootstrap_installation_contract/.wt/initiative.json"
      ]
    },
    {
      "entry_id": "entry.pack_bootstrap_installation_contract.gate_validation",
      "acceptance_label": "ready_for_execution_gate",
      "validation_type": "readiness_gate",
      "owner": "repository_maintainer",
      "target_phase": "readiness",
      "expected_output_paths": [
        "plan/initiatives/pack_bootstrap_installation_contract/.wt/discrepancies"
      ]
    }
  ]
}
